number,value,datetime_start,datetime_complete,duration,params_activation,params_batch_size,params_dropout_rate,params_embedding_dim,params_first_neurons,params_learning_rate,params_n_layers,params_shrink_factor,params_use_l2,user_attrs_architecture,user_attrs_test_deviance,state
0,0.2739931119384351,2026-03-20 09:22:07.471627,2026-03-20 09:22:39.814759,0 days 00:00:32.343132,selu,10000,0.06276063663515687,3,48,0.007045120360898847,7,0.4668630164307128,True,"[48, 22, 16, 16, 16, 16, 16]",0.2739931119384351,COMPLETE
1,0.2711688532007423,2026-03-20 09:22:39.815955,2026-03-20 09:23:32.049467,0 days 00:00:52.233512,tanh,50000,0.11184961388697695,2,272,0.013963168813379378,3,0.5507405608729345,False,"[272, 149, 82]",0.2711688532007423,COMPLETE
2,0.27904177289741067,2026-03-20 09:23:32.050497,2026-03-20 09:24:09.102440,0 days 00:00:37.051943,tanh,10000,0.17307044982000985,1,64,0.010372281847037146,6,0.6100688947187105,True,"[64, 39, 23, 16, 16, 16]",0.27904177289741067,COMPLETE
3,0.2790511443242789,2026-03-20 09:24:09.103531,2026-03-20 09:25:02.935747,0 days 00:00:53.832216,tanh,10000,0.17965768376272415,2,256,0.00825948862141612,5,0.5378823760261178,True,"[256, 137, 74, 39, 21]",0.2790511443242789,COMPLETE
4,0.2742451982425801,2026-03-20 09:25:02.937075,2026-03-20 09:26:34.573597,0 days 00:01:31.636522,relu,50000,0.11632988409798922,3,144,0.00011749640458500633,5,0.7260429705367376,True,"[144, 104, 75, 55, 40]",0.2742451982425801,COMPLETE
5,0.2689401074873089,2026-03-20 09:26:34.574975,2026-03-20 09:27:48.679561,0 days 00:01:14.104586,selu,10000,0.02653805190086723,3,320,0.0003843021147500349,7,0.7288855263809064,False,"[320, 233, 170, 123, 90, 65, 47]",0.2689401074873089,COMPLETE
6,0.2885795533657074,2026-03-20 09:27:48.680666,2026-03-20 09:28:09.999763,0 days 00:00:21.319097,selu,100000,0.19768202106785907,3,128,0.0002959682667433826,6,0.7487201756292513,False,,,PRUNED
7,0.2788175642490387,2026-03-20 09:28:10.000933,2026-03-20 09:28:52.747782,0 days 00:00:42.746849,relu,100000,0.05000823935965743,3,208,0.008624787020628596,6,0.5699501916884212,False,,,PRUNED
8,0.2708701191996725,2026-03-20 09:28:52.749123,2026-03-20 09:29:44.189245,0 days 00:00:51.440122,relu,50000,0.0004197069357131489,2,192,0.003239098534973118,4,0.5495069670473347,False,"[192, 105, 57, 31]",0.2708701191996725,COMPLETE
9,0.33930400013923645,2026-03-20 09:29:44.190689,2026-03-20 09:30:03.166626,0 days 00:00:18.975937,selu,100000,0.2972678408774481,4,64,5.861931694107775e-05,5,0.5504596060150924,False,,,PRUNED
10,0.2780236601829529,2026-03-20 09:30:03.167765,2026-03-20 09:30:35.118710,0 days 00:00:31.950945,selu,10000,0.2674457625243737,4,320,0.0009624171885671726,7,0.9216831733002959,False,,,PRUNED
11,0.27826642990112305,2026-03-20 09:30:35.119891,2026-03-20 09:31:06.396481,0 days 00:00:31.276590,relu,50000,0.007202891694501206,1,320,0.0015853969190530635,3,0.8297671399053657,False,,,PRUNED
12,0.27094929993233885,2026-03-20 09:31:06.397670,2026-03-20 09:32:03.723525,0 days 00:00:57.325855,relu,50000,0.0005132457217086571,2,208,0.0017512659073681892,4,0.6629905623863829,False,"[208, 137, 91, 60]",0.27094929993233885,COMPLETE
13,0.28151461482048035,2026-03-20 09:32:03.724860,2026-03-20 09:32:23.874145,0 days 00:00:20.149285,selu,10000,0.058464351157319724,2,256,0.0005333925321972837,4,0.4402754824912555,False,,,PRUNED
14,0.2705657234841435,2026-03-20 09:32:23.875327,2026-03-20 09:33:18.607719,0 days 00:00:54.732392,relu,50000,0.032625764168423735,1,144,0.0031619741481135203,4,0.7952782562777159,False,"[144, 114, 91, 72]",0.2705657234841435,COMPLETE
15,0.28680890798568726,2026-03-20 09:33:18.609157,2026-03-20 09:34:07.150034,0 days 00:00:48.540877,relu,50000,0.09815811024113189,1,160,0.00026334715938426955,7,0.8085638628156063,False,,,PRUNED
16,0.26904155101336363,2026-03-20 09:34:07.151173,2026-03-20 09:34:44.837668,0 days 00:00:37.686495,selu,10000,0.03839914532796209,4,112,0.003358294254209622,4,0.9151989432019481,False,"[112, 102, 93, 85]",0.26904155101336363,COMPLETE
17,0.28098270297050476,2026-03-20 09:34:44.838802,2026-03-20 09:35:06.019563,0 days 00:00:21.180761,selu,10000,0.08417685621578122,4,96,0.000542545301057309,5,0.9492900635324234,False,,,PRUNED
18,0.2845855951309204,2026-03-20 09:35:06.020692,2026-03-20 09:35:29.916939,0 days 00:00:23.896247,selu,10000,0.1366841284769532,4,96,0.0039352955121397986,6,0.8954360195904856,True,,,PRUNED
19,0.28584152460098267,2026-03-20 09:35:29.918140,2026-03-20 09:35:47.959612,0 days 00:00:18.041472,selu,10000,0.22037861899166786,4,112,0.00019780936624355153,3,0.8794019995741118,False,,,PRUNED
20,0.2689017383551851,2026-03-20 09:35:47.964211,2026-03-20 09:36:42.397185,0 days 00:00:54.432974,selu,10000,0.029504112318204222,3,288,0.001035017385127823,4,0.6814375494259668,False,"[288, 196, 133, 91]",0.2689017383551851,COMPLETE
21,0.2758432924747467,2026-03-20 09:36:42.398303,2026-03-20 09:37:18.766405,0 days 00:00:36.368102,selu,10000,0.03702891013624065,3,288,0.0009466203823773419,4,0.6832036639213513,False,,,PRUNED
22,0.28020718693733215,2026-03-20 09:37:18.767508,2026-03-20 09:37:38.150012,0 days 00:00:19.382504,selu,10000,0.07648542698720992,3,288,0.0005715019105618792,4,0.6384472772542841,False,,,PRUNED
23,0.27877646684646606,2026-03-20 09:37:38.151126,2026-03-20 09:37:55.453030,0 days 00:00:17.301904,selu,10000,0.02750959797916552,4,224,0.0020752565652429255,3,0.7367906560839416,False,,,PRUNED
24,0.2689929410839431,2026-03-20 09:37:55.454140,2026-03-20 09:38:40.735007,0 days 00:00:45.280867,selu,10000,0.03271601069806338,3,304,0.0011570799755600204,5,0.8443482422350972,False,"[304, 256, 216, 182, 154]",0.2689929410839431,COMPLETE
25,0.2772827446460724,2026-03-20 09:38:40.736092,2026-03-20 09:39:06.760241,0 days 00:00:26.024149,selu,10000,0.1446438891749905,3,304,0.0007823891629691311,5,0.8486369268898808,False,,,PRUNED
26,0.3259800374507904,2026-03-20 09:39:06.761523,2026-03-20 09:40:01.460623,0 days 00:00:54.699100,tanh,100000,0.023977171949271736,3,240,0.00039118694189485206,6,0.7738152444794142,True,,,PRUNED
27,0.2835198938846588,2026-03-20 09:40:01.461705,2026-03-20 09:40:24.175227,0 days 00:00:22.713522,selu,10000,0.07277248328462767,3,288,0.00017096507389809074,5,0.690618819064832,False,,,PRUNED
28,0.28363993763923645,2026-03-20 09:40:24.176531,2026-03-20 09:40:49.867531,0 days 00:00:25.691000,selu,10000,0.09684666482419875,2,320,0.00013614027863096748,7,0.7057644099413914,False,,,PRUNED
29,0.28456205129623413,2026-03-20 09:40:49.868641,2026-03-20 09:41:14.102972,0 days 00:00:24.234331,selu,10000,0.05955825793008045,3,272,0.0014307075780345872,6,0.49823103344664793,True,,,PRUNED
30,0.27027604710350006,2026-03-20 09:41:14.104272,2026-03-20 09:41:47.327267,0 days 00:00:33.222995,selu,10000,0.017576568595262847,3,304,0.005527856941891052,7,0.6290361549543989,False,"[304, 191, 120, 75, 47, 29, 18]",0.27027604710350006,COMPLETE
31,0.2693830954755554,2026-03-20 09:41:47.328395,2026-03-20 09:42:26.162859,0 days 00:00:38.834464,selu,10000,0.04044647008773401,4,304,0.002273133665616686,4,0.8641871441171103,False,"[304, 262, 227, 196]",0.2693830954755554,COMPLETE
32,0.26943972141919126,2026-03-20 09:42:26.164003,2026-03-20 09:43:07.981025,0 days 00:00:41.817022,selu,10000,0.050801324048643196,3,256,0.0013124143012211197,5,0.915224440357807,False,"[256, 234, 214, 196, 179]",0.26943972141919126,COMPLETE
33,0.28097933530807495,2026-03-20 09:43:07.982252,2026-03-20 09:43:37.196269,0 days 00:00:29.214017,tanh,10000,0.01584474013073966,4,176,0.0007324371843158577,3,0.7722091724242885,False,,,PRUNED
34,0.2793404161930084,2026-03-20 09:43:37.197409,2026-03-20 09:43:56.904583,0 days 00:00:19.707174,selu,10000,0.11305138554345012,2,272,0.015877688251926945,4,0.8311687332288045,False,,,PRUNED
35,0.28650641441345215,2026-03-20 09:43:56.905710,2026-03-20 09:44:31.220485,0 days 00:00:34.314775,tanh,10000,0.06675803277278626,3,48,0.005030860054765606,5,0.9482969505342091,True,,,PRUNED
36,0.27860182523727417,2026-03-20 09:44:31.221612,2026-03-20 09:44:51.596060,0 days 00:00:20.374448,selu,10000,0.08731628471826064,4,240,0.0011818789477314661,4,0.6006532988286658,False,,,PRUNED
37,0.31517961621284485,2026-03-20 09:44:51.597176,2026-03-20 09:45:08.917041,0 days 00:00:17.319865,selu,100000,0.12668447718998513,2,304,0.00036441154028676013,3,0.7216774133626097,True,,,PRUNED
38,0.2707358409634295,2026-03-20 09:45:08.918169,2026-03-20 09:46:20.705893,0 days 00:01:11.787724,tanh,10000,0.035953783134212304,3,288,0.002480883698796941,5,0.7676640901728844,False,"[288, 221, 169, 130, 100]",0.2707358409634295,COMPLETE
39,0.2824186682701111,2026-03-20 09:46:20.707352,2026-03-20 09:46:42.830890,0 days 00:00:22.123538,selu,100000,0.04851841163096549,3,240,0.01026210486440454,6,0.6591973864580816,False,,,PRUNED
