number,value,datetime_start,datetime_complete,duration,params_activation,params_batch_size,params_dropout_rate,params_embedding_dim,params_first_neurons,params_learning_rate,params_n_layers,params_shrink_factor,params_use_l2,user_attrs_architecture,user_attrs_test_deviance,state
0,0.2828654176352459,2026-03-20 10:04:49.514910,2026-03-20 10:05:25.641401,0 days 00:00:36.126491,selu,10000,0.06276063663515687,3,48,0.007045120360898847,7,0.4668630164307128,True,"[48, 22, 16, 16, 16, 16, 16]",0.2828654176352459,COMPLETE
1,0.27521604218230733,2026-03-20 10:05:25.642430,2026-03-20 10:05:58.070881,0 days 00:00:32.428451,tanh,50000,0.11184961388697695,2,272,0.013963168813379378,3,0.5507405608729345,False,"[272, 149, 82]",0.27521604218230733,COMPLETE
2,0.28286227069610353,2026-03-20 10:05:58.071901,2026-03-20 10:06:28.487729,0 days 00:00:30.415828,tanh,10000,0.17307044982000985,1,64,0.010372281847037146,6,0.6100688947187105,True,"[64, 39, 23, 16, 16, 16]",0.28286227069610353,COMPLETE
3,0.2828612727339833,2026-03-20 10:06:28.488743,2026-03-20 10:07:00.231784,0 days 00:00:31.743041,tanh,10000,0.17965768376272415,2,256,0.00825948862141612,5,0.5378823760261178,True,"[256, 137, 74, 39, 21]",0.2828612727339833,COMPLETE
4,0.2827074715370031,2026-03-20 10:07:00.232805,2026-03-20 10:08:16.407620,0 days 00:01:16.174815,relu,50000,0.11632988409798922,3,144,0.00011749640458500633,5,0.7260429705367376,True,"[144, 104, 75, 55, 40]",0.2827074715370031,COMPLETE
5,0.2725986778165549,2026-03-20 10:08:16.408884,2026-03-20 10:09:23.443979,0 days 00:01:07.035095,selu,10000,0.02653805190086723,3,320,0.0003843021147500349,7,0.7288855263809064,False,"[320, 233, 170, 123, 90, 65, 47]",0.2725986778165549,COMPLETE
6,0.21331173181533813,2026-03-20 10:09:23.445406,2026-03-20 10:09:48.228567,0 days 00:00:24.783161,selu,100000,0.19768202106785907,3,128,0.0002959682667433826,6,0.7487201756292513,False,,,PRUNED
7,0.21209900081157684,2026-03-20 10:09:48.229729,2026-03-20 10:10:14.935267,0 days 00:00:26.705538,relu,100000,0.05000823935965743,3,208,0.008624787020628596,6,0.5699501916884212,False,,,PRUNED
8,0.27409965130860586,2026-03-20 10:10:14.936446,2026-03-20 10:10:56.286345,0 days 00:00:41.349899,relu,50000,0.0004197069357131489,2,192,0.003239098534973118,4,0.5495069670473347,False,"[192, 105, 57, 31]",0.27409965130860586,COMPLETE
9,0.26990848779678345,2026-03-20 10:10:56.287581,2026-03-20 10:11:17.149323,0 days 00:00:20.861742,selu,100000,0.2972678408774481,4,64,5.861931694107775e-05,5,0.5504596060150924,False,,,PRUNED
10,0.20854240655899048,2026-03-20 10:11:17.150647,2026-03-20 10:11:48.597710,0 days 00:00:31.447063,selu,10000,0.2674457625243737,4,320,0.0009624171885671726,7,0.9216831733002959,False,,,PRUNED
11,0.207755446434021,2026-03-20 10:11:48.598831,2026-03-20 10:12:12.575825,0 days 00:00:23.976994,relu,50000,0.007202891694501206,1,320,0.0015853969190530635,3,0.8297671399053657,False,,,PRUNED
12,0.20767807960510254,2026-03-20 10:12:12.577026,2026-03-20 10:12:36.694153,0 days 00:00:24.117127,relu,50000,0.0005132457217086571,2,208,0.0017512659073681892,4,0.6629905623863829,False,,,PRUNED
13,0.21113838255405426,2026-03-20 10:12:36.695272,2026-03-20 10:12:56.627338,0 days 00:00:19.932066,selu,10000,0.058464351157319724,2,256,0.0005333925321972837,4,0.4402754824912555,False,,,PRUNED
14,0.272978801989921,2026-03-20 10:12:56.628446,2026-03-20 10:13:34.804059,0 days 00:00:38.175613,relu,50000,0.032625764168423735,1,144,0.0031619741481135203,4,0.7952782562777159,False,"[144, 114, 91, 72]",0.272978801989921,COMPLETE
15,0.21238182485103607,2026-03-20 10:13:34.805277,2026-03-20 10:14:01.889778,0 days 00:00:27.084501,relu,50000,0.09815811024113189,1,160,0.00026334715938426955,7,0.8085638628156063,False,,,PRUNED
16,0.2729033441425144,2026-03-20 10:14:01.890946,2026-03-20 10:14:44.355028,0 days 00:00:42.464082,selu,10000,0.03839914532796209,4,112,0.003358294254209622,4,0.9151989432019481,False,"[112, 102, 93, 85]",0.2729033441425144,COMPLETE
17,0.21011488139629364,2026-03-20 10:14:44.356353,2026-03-20 10:15:06.481868,0 days 00:00:22.125515,selu,10000,0.08417685621578122,4,96,0.000542545301057309,5,0.9492900635324234,False,,,PRUNED
18,0.21248584985733032,2026-03-20 10:15:06.483124,2026-03-20 10:15:31.573792,0 days 00:00:25.090668,selu,10000,0.1366841284769532,4,96,0.0039352955121397986,6,0.8954360195904856,True,,,PRUNED
19,0.21201092004776,2026-03-20 10:15:31.575010,2026-03-20 10:15:49.690278,0 days 00:00:18.115268,selu,10000,0.22037861899166786,4,112,0.00019780936624355153,3,0.8794019995741118,False,,,PRUNED
20,0.27283506157633486,2026-03-20 10:15:49.691481,2026-03-20 10:16:34.091848,0 days 00:00:44.400367,selu,10000,0.029504112318204222,3,288,0.001035017385127823,4,0.6814375494259668,False,"[288, 196, 133, 91]",0.27283506157633486,COMPLETE
21,0.2067583054304123,2026-03-20 10:16:34.093096,2026-03-20 10:17:05.798049,0 days 00:00:31.704953,selu,10000,0.03702891013624065,3,288,0.0009466203823773419,4,0.6832036639213513,False,,,PRUNED
22,0.20866429805755615,2026-03-20 10:17:05.799213,2026-03-20 10:17:26.497031,0 days 00:00:20.697818,selu,10000,0.07648542698720992,3,288,0.0005715019105618792,4,0.6384472772542841,False,,,PRUNED
23,0.20694424211978912,2026-03-20 10:17:26.498274,2026-03-20 10:17:53.521495,0 days 00:00:27.023221,selu,10000,0.02750959797916552,4,224,0.0020752565652429255,3,0.7367906560839416,False,,,PRUNED
24,0.2731915117106328,2026-03-20 10:17:53.522739,2026-03-20 10:18:37.885936,0 days 00:00:44.363197,selu,10000,0.03271601069806338,3,304,0.0011570799755600204,5,0.8443482422350972,False,"[304, 256, 216, 182, 154]",0.2731915117106328,COMPLETE
